text,quality,delivery
"Worthy of Awards? I Think Not. My opinion of ""The Giver"", is the same opinion as theone I have about Puley Shore movies. They're quite entertaining in thebeginning, but after awhile, the plot gets dull and eventually loses its flavor. The idea of having a perfect society is a good idea for a story, but dragging out the idea that the characters have no emotions gets a tad bit annoying. I get the idea that the characters have no emotions, but Lois Lowery has to tell the reader every other sentence. She acts like the reader is going to forget or something. I admit, the beginning of the story is good; how Lowery tells you about the society's rules, and the Giver's job, but after all that is said, she says the same thing over again. And the ending was the worst ever in the history of literature. This is a horrible book. I suggest it to people who like to get cheated when they read or anyone who saw ""Lost in Space.""",neg,neg
"Our toddler loves it so far. We received this bench as a xmas present for our toddler. The box was slightly damaged, as we have noticed pretty much all furniture from Amazon is delivered. One of the arm pieces was split, which we had to glue and clamp back together, but it is now fully functional.Other people have commented on how little storage there is, but the entire bench portion is hollow, so there is as much storage as there possibly could be for a product this size. Maybe they were thinking that the bench were bigger?We haven't had this for too long yet, so I can't speak to its durability.",pos,neg
"Fire Extinguisher. By other reviews some people experienced their fire extinguishers arriving damaged; mine was packaged well and arrived intact. I hung it up on the wall and I do have to say that was a bit difficult, but we managed to get it secured and hopefully I will never have to take it down. Appears if that ever happens, taking it down will be simple.",pos,neg
"More than just an action classic. The Mechanic has some pretty good action sequences but it is the period decor and clothing that is the real star of this movie some 40 years later.Check out Charles Bronson's man-pad with its cheesy chocolate brown interior and Moroccan-style lamps. And what's going on with a fearsome hit man wearing red pyjamas?Then there's the surreal white mansion with its blue trimming and billiard-table green carpet - an absolute riot.Best of all is Hollywood's idea of a 'swinging party' that takes place at Jan Michael Vincent's pad - full of 'hippies' straight out of central casting.Gotta love the baddy's mansion's antiquated security system which looks like it has been stolen from an old episode of Lost In Space. Then there are all those touch dial phones.Classic Bronson, classic action, classic 70s!",pos,neg
"ehh disappointed.... I loved the first book...Chase was so kind and loving and sexy--and here comes Mason...with more than enough problems and was never nice just to be nice. I think he had too many problems...either make him a drinker or make him damaged from his divorce but the fact that he had both was a downer...which made Ellie even more a downer...she should have been stronger, and more deserving of a better guy--just cause she is the heavy sister means she has to learn to deal with someone elses issues because shes got her own. I was annoyed. Wanted to like it...but didnt.Im hoping story 3 is better!",neg,neg
"Works as Advertised....so far.. I wasn't sure about ordering this since the one review was pretty negative; but, I decided to try it anyway. It shipped super fast and I installed it right away. My 4 year old daughter likes to have all of her ""important"" things at arms reach in the car, so I needed something to organize the clutter. I ordered 2, but think I will only need one now that it's in. I'll give the other one to my husband for his car. The pockets are pretty big--we put a good sized fleece blanket in the largest part. There is room for a couple of drink bottles, wipes, movies and a couple of small toys. And, I love the umbrella holder. Her little Dora umbrella fits perfectly.Overall, a great product. Now, lets see how durable it will be. I will write another review if I find that it doesn't wear and tear well.",pos,pos
"Much Ado About Nothing. Despite of having the hand of a true great director at the helm and a multi-star cast (including a top-notch soundtrack by U2), the movie lacks the rhythm and charisma needed to live up to its expectations, with great performances lost in a bad script. It's just a wanna-be art movie, and nothing else.",neg,neg
"Confusing, Long and Boring. Was this story lost in translation? I almost gave up on this book half a dozen times, but kept on reading thinking it could only get better. Boy was I wrong!The dozens of characters blur together in an entanglement of crooked, incestuous limbs on a family tree. Even the family chart (yes, a chart) provided at the beginning of the book wasn't enough to keep the members of the Buendia family straight. Look elsewhere!",neg,neg
"Too Cryptic to Be Understandable, Let Alone Scary. I don't get it. This book is supposed to be a classic of the horror genre. Just about everyone agrees on that point. The negative reviews stick out like sore thumbs. Well, here's another sore thumb. The premise is great. An evil carnival comes to town and preys on the emotional and spiritual weaknesses of the residents. The problem is that the story gets lost in the enigmatic writing style that Bradbury chose for this book. Half the time, I didn't really know what was going on. Maybe I'm missing something. If I am, I'm missing it by a mile.",neg,neg
"Quality and Repair service is Horrible. My new Clie worked for about a week and the memory card would notremain retained in the slot. Took forever n the phone to get a return authorization and then forever to get the unit back. Had it back for 4 weeks and the screen froze in the on mode. Could not be reset. Again went through all of the above grief and got the unit back in a ""repaired state"". Then it would not interface with the PC. I gave up. Sony won't take it back other than to try and fix again and neither will Dell mail order, my original source. Hopefully the credit card company will take care of this more effectively. Advertised features and functionality is great, but will it work? Service needs to be improved agreat deal.",neg,neg
"Too over the top. Having read every single book in the Gor series, I can honestly say that this is the only one of the early books that I don't like, and can't re-read. Norman does best when the physical action is coming at you fast and furious; not so good when the only action taking place involves complex human interactions.Not only are many of the scenes way over the top, but there were too many characters to keep track of. At times, Tarl Cabot gets lost in the storyline. I simply didn't care enough about many of the minor characters to want to hear much about them.I think it was just a bit too ambitious an undertaking for Norman, and it didn't play into his strengths as a writer. Fortunately, this is the last book of this type.",neg,neg
Highly Recommend Seller. Highly recommend seller. Product as advertised. Arrived on time and in good condition. Would definitely buy from this seller again.,pos,pos
"best blocks ever!. I was so pleased with my purchase of these blocks.. My 3,5, and 6 yr old kids all love them.. They will play with them for hours.. they arrived on time and I would definitely buy from this seller again!",pos,pos
"book seperated from spine on second page , large hole, smelled bad. The book looked great but I opened it to the second page and it is seperated from the spine of the book. I was more than a little aggravated Yes it is a used book but it is also a damaged book. also had a smell to it You can read it but it won't last long and it was intended for a gift which is no longer possible.",neg,neg
perfect. This product is very reasonably priced and was shipped quickly. It does exactly what it is meant to do and has helped me free up shelf space. With everything organized my husband no longer grabs my freezers bags for his sandwhiches. I'm saving money already!,pos,pos
"This one is a bottom-feeder - really awful. This book was huge disappointment. Many items in the text are wrong, and Carol McCullough-Dieter obvious has no business writing Oracle books. There are so many wrong items, that it is not worth commenting on them. Avoid this bad apple at all costs.",neg,neg
"Worst ever. I would have rated this minus 5, but that was not an option. This is neither instant nor is it DVD. It took 2 weeks of intensive work to try to get it to work--it never did! I even had to reinstall Windows XP! Tech support NEVER got back to me, and by the time you finally give up, its too late to return. This will make you homocidal! Don't waste your time and energy.",neg,neg
"A MUST have for boys of ALL ages. This is a MUST have book for boys of all ages. It has many crafty hands-on projects geared for living in the country. Really great for getting a child to use his mind and hands in a productive rewarding way. I had this same book when I was a child and enjoyed it through my early teens. The knowledge gained has lasted the years but the book hasn't. So, I was happy to find it through Amazon. And for such a reasonable price. It made a great birthday present for my son.It arrived quickly and was in NEW condition like stated.",pos,pos
"Not suitable for 5 year olds. I was very disappointed with this book. I bought it to read to my 5 year old twins. It is not a picture book which disappointed them but I knew that going in. For me, it was the awful old style wording that was so far off anything a 5 year old would appreciate. They lost interest very fast. I had to keep reading ahead and change the wording to try and make it understandable for them. I wish I hadn't wasted my money on this book and certainly would never recommend it.",neg,neg
review. The product was shipped fast but the portion that plugs into the wall was cheaply made and broke quickly. The cord and the car charger still seem to work,neg,pos
Doesn't work. This doesn't work at all. It came early thank goodness but after I ate the whole jar I was still constipated. The only thing it did was make my pee glow in the dark. What a rip-off!,neg,pos
INTEX air bed. The item arrived on time and was easy to set up. It stayed inflated the entire night and was quick to deflate the next morning. We have always been Aerobed purchasers in the past and now find this Intex to be just as good quality wise.,pos,pos
where is my order???. I researched this item on the Amazon website and finally decided to order it back in September!! I have received two emails saying the order was delayed. It is now January '07...still no CharBroil grill. I am really looking forward to using it. Hope it comes before the Super Bowl!!,neg,neg
"If you don't already know the theory, don't bother.... I hate to be the only one to not give the book ""5 stars"", but this is simply not the best book to buy if you want to learn the theory of relativity. The book is certainly worthwhile if you want something simply because it was written by Einstein, but God bless him, the old guy just couldn't put the idea accross as well as many modern authors. Maybe something is just lost in the translation, I don't know...",neg,neg
"1/3 Alice, 2/3 Harry Potter. Alice in Wonderland is the tale of a little girl lost in a land of nonsense. A land of NONSENSE!This movie has hardly any nonsense at all. It feels more like a Harry Potter movie than Alice in Wonderland. I wanted Alice. Alice get's trapped in a surreal dream-like Wonderland where everything is nonsense and there is tons of wordplay, puns, ect.And the nerve to name the movie Alice in Wonderland. It's not that story. They should've named it Return to Wonderland: The Battle to Make a Harry Potter movie with Alice Characters.",neg,neg
"Excellent service but cost was average. This product was shipped quickly and arrived in excellent condition. The product is exactly as expected. The price was fair as I found it days later for sale for the same price at the big electronics stores. I was hoping to get a better deal by buying it online. Other than this, I would purchase from this company again.",pos,pos
"Outstanding Services. I purchased the Queen Celebrity 12 inch pillow top memory foam mattress from Dynasty Mattress. The service was excellence. Tony has responded well to the issues, shipment delay, damaged package. I have not used the mattress due to moving. However, I would like to put in review for the outstanding service from this seller.",pos,neg
"Warning. This is a fairly entertaining thriller with a nice performance by Harrison Ford in his standard 'everyman' role to recommend it. Unfortunately Emmanuelle Seigner looks lost in her role and gets blown off the screen in every scene she and Ford share. But be warned, this DVD lacks any bonus materials and can only be viewed in pan/scan mode. There are no titles, no chapter index, not even a selection menu at the beginning of the movie (no features to select from). It doesn't seem as if the picture has been enhanced nor has the sound been remastered. Pretty lame.",neg,neg
"Avoid this One and save your time and money. Eric Flint is a learned and knowledgeable historian with a splendid imagination. He has co authored a number of good alternative history books with David Drake and his 1632 was excellent. Left to his own devices, however, or with a lesser editor, he becomes lost in the twists and twirls of his own highly nuanced world. He has a difficult time sustaining realistic characters. (Pretty much the same set of heros again and again.) Here, another reviewer compared this to reading a high school newspaper, which is apt -- but more likely one will find as much benefit reading off of Flint's fan website and finding that various folks have given additional life to his characters in his alternate universe. So let's join those who hope that he will return to the main flow, with a better editor and prove himself an independent success.",neg,neg
"Story took way too long to develop. Very dissapointing. As a huge fan of the Alex Delaware novels and Jonathan Kellerman's style of writing, I was really looking forward to reading this book. Unfortunately, I found the main character, Jeremy Carrier, to be sad, whiny and an all around boring guy! The story took forever to develop and by the time it did I had stopped caring what happened. He spent too much time introducting characters that ending up having little or nothing to do with the plot. I was surprised at some of the twists near the end, but they weren't enough for me to recommend this book. I finished reading it only to find out ""who done it"". I recently read his new novel ""Therapy"" which I would recommmend along with most of the other Delware novels.",neg,neg
"First two arrived damaged, waiting for number 3. Two chargers arrived with major dents on the bottom (see pictures I posted). Schumacher ships them without adequate protective packaging. It may be a good charger if you can get an undamaged unit. I'm waiting for the third one now.Update: Third charger arrived without dents and was packed the same way as the first two. The housing is made of thinner metal than the 20+ year old Schumacher that died last month. I did raise the rating from 1 star to 2 stars since I ended up with a good unit after three tries and it works well (big star reduction since it took THREE trys!).",neg,neg
Booooorrrrring. I'll probably get beat up for this but Battlestar Galactica was a waste of television airtime and it's even a bigger waste of a perfectly good dvd disc. The performances are lackluster probably because everyone was just there to make a buck. The stories were silly and the dialogue is even sillier. Even Mel Blank (the voice of the robot) couldn't help this sorry piece of trash. Don't waste your money here. You're better off watching Lost in Space or Star Trek.,neg,neg
Good Book. This book was in great shape when i got it. It shipped quickly. I am using it for a shakespeare class in college. It is an interesting read.,pos,pos
"Happy Co. Makes Unhappy Customers. I ordered these slippers as a gift. To my embarassment, the gift never arrived. I received an email stating that the slippers were backordered. Weeks later I received another email stating it would be an indefinite time before the product would be available. I just cancelled the order. I am defiitely an UN-Happy customer.",neg,neg
"Absolutely Horrible!. Saw this movie thinking it truly must be worth all of the hype. Not that far into it I turned to my friend and said ""If Nicholas Cage masturbates one more time, I'm leaving!""Shining perfomance (once again) by Chris Cooper, and the story between him and Meryl Streep was worth watching. However in this film, their wonderful performances were wasted.As for Nick, I generally like the guy, but this movie was a stretch for him. The entire time I felt as though I was watching a guy who was acting, and not as if I were in the story. Not sure what all of the buzz was about. Truly a disappointment in my view.Spend your money on ""Lost in Translation.""",neg,neg
"a thoughtful critique. 'Kay. I know Kubrick is, like, a ""total genius"" and all, but this movie was less coherent than a brain-damaged first-grader trying to explain to a neanderthal how to build a nuclear reactor (believe it or not that simile took two drunk people five minutes to come up with. hurray for college!).Wow, totally lost track of what I was trying to say about this movie. Suffice it to say, it sucked, just like every movie Kubrick made. The best part of any of his movies is when the end credits start rolling.~fin~",neg,neg
"black austin air purifier. I bought the air purifier because someone in my home is ill. The air purifier would assist him to heal, and feel better. When I received the air purifier it was severely damaged. I could not use it. We were very disappointed. Luckily, I had also purchased another one. It arrived in perfect condition. Since we needed it so badly, for weeks we carried the one we have from floor to floor in our house. The item itself, when it is working, is excellent. I would recommend it, as the best air purifier on the market. I recently purchased another air purifier, so now we have one on each floor. We are breathing much better!",neg,neg
"Great compilation, but.... I have to say the production quality is terrible. My high school mixed tapes were cleaner and higher fidelity than this album. During the song Lost In Motion - one of the more tranquil, moody tracks - there's a HUGE pop that totally ruins the mood of the song. You'd think if you were going to spend the time and money producing an album, you'd either get better vinyl, or fix the screw-ups in post. And I'm not just talking dust on a record, this is a huge pop like somebody put a fork to the record and plugged it into a high voltage outlet. Not what I expect from a professionally produced trance CD.Other than that, great compilation.",neg,neg
"Do NOT recommend purchasing this product from Health & Personal Care (Beta). I received the shipment of 3 cans from the vendor, all cans are damaged at certain degrees around the top and bottom edges. I am not quite sure whether they are contaminated or not and therefore plan to return them.This is the second time I received bad items from this vendor and will be the last time.The product is very good, my babies love it.",neg,neg
"Received vinyl record in two pieces. I was very excited to receive ""A Love Supreme"". It was shipped fast and the packaging looked good. I immediately opened it up and go to play it but alas the record was snapped in half. Heartbreaking! Now I have to ship it back because this order from the shipper - NorAm International Partners doesn't have a replace item for this product. BOOOOOOO!!!!!",neg,pos
Love my Total woman vitamins.. I love my Total Woman vitamins. I got my vitamins for a great price and fast delivery. I would definitely order from them again.,pos,pos
"You can't go wrong with the SOG Blink. I had bought this knife as a replacement for a Gentleman SOG I'd owned for nearly ten years which I'd recently lost in a Taxi in Bangkok.Unlike a previous reviewer, I did not find the spring to be too strong. It takes some practice, but once you get the hang of opening the knife with your thumb opening is very easy and instant.In short, this is a great personal pocket knife at a reasonable price. I expect this knife to be my daily companion for the next ten years as well.",pos,neg
"Blank (no image) baseball caps. The quality of the caps was really good. Very fast delivery. A wonderful low price, too.",pos,pos
"Disappointed. I guess I'm the only one who wasn't totally insired by her story. I did not follow her stories in Glamour, but I am a young woman who was diagnosed with cancer in her 20s. I was expected to find a lot of situations I could relate to. There were a few, but I kind of lost interest when I felt she kept going on and on about everything she did for the Leukemia & Lymphoma Society. Compared to the cancer survivors I know in real life, she just seemed unreal. But then again, all the cancer survivors I know have been through chemo and/or radiation.",neg,neg
Just as ordered. Purchased as a replacement for a damaged library book. Found by searching ISBN number and got the exact edition that the library wanted.,pos,neg
Good. This is an excellent item. The seller shipped fast and I am 100% satisfied with the overall transaction. Would definitely buy from this seller again.,pos,pos
"Fire Extinguisher Discharged. The item arrived on time but when I opened it, the fire extinguisher clearly discharged. There was some powder residue all over the place and the red plastic pin was found at the bottom the box. This item should have been packaged more carefully. It does look like I am not the only one who had this issue. I guess it's my loss. I can't return it.",neg,pos
"Don't waste your money. I bought 2 (medium and small) for my 2 dogs (medium - Irish water spaniel and small - terrier).Within 1 1/2 hours, the medium one was totally destroyed and the other one damaged.",neg,neg
"The worst customer service. While the quality of the item seems above the norm, customer service from this company is dreadful. My new equipment sat around in boxes waiting for a replacement for a damaged shelf that was delayed, then delayed again, by mix-ups on the company's part. Their refusal to budge an inch from their standard process, even though it meant further delay for a very unhappy consumer who had gotten tired of run-arounds and excuses, is a far cry from the real customer service I've experienced elsewhere. I will never buy another TechCraft item.",neg,neg
"Removing the cheesy narration made this film soar.. The Director's Cut of the greatest Sci-Fi film ever made takes the original with its cheesy voice over narration and sappy ending and turns it into a film of subtle nuances and great visual story-telling. The inclusion of the ""unicorn sequence"" also adds a disturbing twist to the end that was completely lost in the theatrical release. I was awestruck by the original release but found myself insulted by the studio's inclusion of the voice-over...this is how the film should have been seen. Take this opportunity and order the Director's Cut now.",pos,neg
"I'll Pass On The Next One. This was an okay read. It took me a long time to finish this book because in certain spots the book was downright boring. I really got tired of Tanya going back and forth on the seesaw trying to decide if she should stay or leave Curtis. And the whole idea of staying in a marriage where the husband lies & disrespects you daily and you know he's cheating but you choose to stay for the sake of your daughter was too much for me to comprehend (I lost interest at that point). Curtis was a terrible person and demonstrated many of the negative attributes associated with ""Black"" churches. This one was okay, not interested in reading the sequels",neg,neg
"Doesn't hold up to my backpack. I bought this adapter almost two years ago and it still works-kind of. The insulation on the area of the cable where it enters the brick has become damaged, exposing the outer wire. I taped it up, but there is always a connection issue, where the AC indicator at the top of the screen will often flash to battery power and then back to AC. I keep the AC adaptor in the front compartment of my backpack, so it sees some but not major abuse. I'm sure this won't be an issue if you aren't traveling with it, but I just thought I would relate my experience.",neg,neg
"Wrong Item; Bad Seller. Don't bother with this seller, they will send you the wrong item. Instead of a SandMaster, I received a lower quality foot bag called a ""Stally."" I wont be doing business with this seller again.",neg,neg
"Boring!. This had to be the most boring cop movie I've ever seen. Not only was it boring, but I found myself hoping the bad guys got away. The movie was basically about a racist, sadistic cop who spent the whole movie either beating innocent African Americans or chasing a drug dealing ring. No intersting dialogue at all. The only halfway good part was the car chase scene, but when Doyle almost hit a woman crossing the street, I lost interest in the dynamics because it was so thoughtless. Then, if you weren't sleep by then, you get to watch the police tear up a drug dealer's car for probably 15 minutes. What was really stupid was that they completely ripped the car up, upholstery and all; however, when the owner picked the car up, it was in tip-top shape. I don't know what other movies this one was up against for the Acadamey Awards, but surely one of them was better.",neg,neg
