text,quality,delivery
"False advertising. Received the correct box, which was damaged as noted in item description, however, the cake dome was not the item pictured and not the item in the product description. It was a very used dome from a different manufacturer and very different style (black and handpainted). Diasppointed as the savings for this particular item was significant when compared to a new one when I took the sellers word as in the product description aned photos.",neg,neg
"A half painted room is a sad sight.. My wife started painting our family room after I ordered my ladder, confident that it would arrive in about 3 weeks, just in time to reach the high parts of the wall by the stairs. The other 3 walls were finished but still no ladder. After about a month I went back to check my order to make sure I hadn't accidentally checked 'Wells Fargo Wagon' as the delivery method. Nope, it said 'UPS' as I had remembered. The ladder was finally shipped more than 7 weeks after it was ordered and arrived quickly. Now we can finish the job.This ladder is everything you would want 1) Made in the USA (similar ladders by Cosco, Werner and Gorilla Ladder are made in China) 2) Flexible (any configuration from step ladder to extension ladder) 3) Stong (it feels safe even when fully extended).",neg,pos
"The Bridge of San Luis Rey. I read this book over summer in a matter of days. I am still trying to understand it now. I thought the book was confusing but still interesting when I did get pulled into the stories of the 5 victims. I think it is a book that should be taught and not just read. You need to have an appreciation for this book, that I obviously have not aquired yet. This book would be better for middle age adults, but kids could give it a try if they are prepared to be thoroughly lost in a novel. Who knows, some people may love this book and say it is the best ever written. But in my opinion, I do not see the point it is trying to make at all.",neg,neg
"Houseboat sunk. ""Houseboat"" never arrived here. I have been patiently waiting at the dock, but no boat. PLEASE send it at once.",neg,neg
"Fragrance too powerful. First, while the product arrived very quickly, the bottle was damaged inside of it's box and had leaked. What a mess. Should have returned it, but decided it was too much trouble. Than fragrance was so strong I had to put it in one of the guest bathrooms, with the door closed.",neg,neg
The Book Is Better. The seller of this item was great. Shipped fast and wonderful communications. HOWEVER - The movie itself was awful. After reading the book the movie was a major disappointment. Don't waste your money,neg,pos
"Hasn't done squat. The product arrived quickly and in good condition. I have had it outside for about 3 weeks now and have not caught squat. The yellow jackets are still flying around, apparently unimpressed.",neg,pos
"broken case. I should have listened to the other reviews but thought I would get lucky. Unfortunately I did not... my case was cracked when I took it out of the box. The packaging looked good so I do not understand why it was broken other than maybe it was not taken care of during shipment. In any case (not a pun), the quality of the case is very cheap and since it was broken it revealed being made of cardboard covered with metal paper. It is obvious that the case would not have lasted that long if it was used at all. Also there is only one handle so the weight of the chips alone would start cracking the entire case.Fortunately nothing inside was damaged from what I case see, though it is obvious the quality inside the case was just as bad. I will be returning the case and chip set, hopefully not having the same bad luck with my next purchase as the ones I bought.",neg,neg
"Sensational, but unexpected!. Going in I had huge expectations, I guess I expected something more akin to Heartache but this album defied expectations! At first listen I perhaps wasn't a huge fan, took the second listen to fully get into it but it was worth the effort! This is an incredible record, super fast riffing, drumming from Justin Foley is superb and Howards voice is even more insane than last album! I'd have to say Adam D's voice could have been left out of some songs, almost sounded a little emo at times (God forbid) but he does produce so what are you gonna do? Overall tho, this band have brought something fresh and exciting to metal and I am pretty stoked about it! As for Highlights, ""For You"" is awesome, ""My Curse"" is an ideal first single, awesome!!",pos,pos
"12 years too late. If it wasn't already evident that the 1993 child abuse allegations were based on money (greed) then the release of this ''tell all'' book certanly clarifies the situation. Let me tell you if my nephew (or any other relative for that matter) had ever being abused (whether or not it was by a celebrity or not) I AM NOT going to release a book which will bring myself ecomic gain at the expense of my ''damaged'' nephew.This book is full of half truths and whole lies, it amazes me that in ''the home of the brave'' the only way to make a buck is by capitalizing off somebody elses ''missfortune''.This book is 12years past its sell-by date and the odour is overpowering, the only place for this book is in the trash",neg,neg
"Satisfied Customer. Would buy again from this seller. Item arrived quickly, and in condition described.Thanks so much!",pos,pos
"Interest decresing towards the end. I noticed that the book lost interest and flow after a couple of chapters. To be honest, the last chapter was so boring that I did not even finish it. I enjoyed the first 5 chapters, though.I guess it was very clear to me how everyting was tied together, exept for a couple of chapters.",neg,neg
"AN EXCELLENT PRODUCT!. I have one of these myself, so was already familiar with this great mug warmer.I bought two and gave them to my brother and his wife for Christmas. They called to say they can't believe how they ever got along without them. Specifically, they said it was wonderful to never again have to drink the second half of their coffee cold. The packaging was great and it arrived on time.",pos,pos
"totally worth it !. Good value for money. It is sturdy and perfect for a 3 year old ! The product arrived on time , and was just as described.",pos,pos
"A Thoroughly Enjoyable Summer Read. This is the definitive story of Laurel Canyon and the rise and fall of the singer-songwriters that defined an era. Fabulous backstage gossip, great interviews, and a long, revealing look at David Geffen and his role in shaping the sound and artistry of so many great musicians -- Joni, Laura, CSNY, Gene Clark, JT, you name it.I enjoyed this book so much I didn't want it to end. It also turned me on to some forgotten songwriters and albums that got lost in the shuffle -- Judee Sill being one amazing example.An essential read for music fans.",pos,neg
"Good Book. I bought this book for my wife, and as usual, it arrived on time and in great shape. No problems. As usual, 4 Stars because only God is Perfect.",pos,pos
Book of Dreams. I was a bit disappointed in this book. The beginning started out well and then I lost interest in the subject matter.,neg,neg
Never received. CD never arrived. Consider this a loss and a lesson learned. Will not be buying from this vendor again.,neg,neg
damaged. this product is damaged and wont work it will stop all together thats the only problem with this item i bought,neg,neg
"BOOOOOOOOOrrring!!!!!. The story line is excellent but unfortunately mired in too many depth-less characters and painfully convoluted subplots. It is slow on the uptake tho thankfully does pick up the pace, but only at the last, and after you have waded through so much extraneous babble that you often wondered where you were headed in the first place---which was, incidentally, a plot to assassinate Churchill and Roosevelt.The book flap summary---and even the design of the dust jacket---made it seem like I was in for a treat. Wrong!! I often did not want to pick it back up (it took forever to finish!!!) but I am determined that if I spend money on a book, I'm going to read it.I would recommend this story to only the most patient of readers and certainly will not read again myself.",neg,neg
"Quick Shipping, Nice Bag.. I really enjoy that I found this bag here, since the heiny color Superbreak is discontinued I believe. The bag shipped quickly too. Standard free shipping and it arrived in about three days. They're trustworthy.",pos,pos
"wrong item delivered. i probably would have liked it, however i was sent the wrong item. i looked forward to using this thing too!",neg,neg
"Over-processed picture = I'm not buying.... Cancelled my pre-order after seeing screenshots of how badly 'damaged' this release has been by over-zealous use of digital processing. The studios need to wake up. The battle scenes are INTENTIONALLY grainy, for goodness sake, so removing the grain just destroys the movie. Thanks, but no thanks.",neg,neg
"wrong item twice. Ordered an antenna the middle of Nov, 05. Received wrong item with in 10 days. I let them aware of problem then I mailed back wrong item. Within 14 days I received duplicate of wrong item. After I emailed them to let them know of problem, I heard nothing. I had to send an ugly email, stating ""what's up?"". They cancelled my order, then refunded original amount charged to credit card, plus .11 cents. Still fighting for them to reimburse me for my cost to send back 2 wrong items.",neg,neg
A must for any American boy at heart. I was given a first edition by my grandfather in 1973. It was sadly lost in a fire in 1982. I have since been looking for another copy to pass to my son. All of the projects are simple and straight forward. Beard's musings on boyhood and the fundamental task of growing up are right on the mark - even for today's techno child. A must have for any library!,pos,neg
"This movie doesn't follow the other movies. I watched this movie on cable last night; and it was horrible. It was the worst Nightmare on Elm Stret Movies ever. It doesn't follow the story line at all from the past movies. It took forever, for anything scary to happen. Also, the movie wasn't as gory or bloody like previous movies. Not worth buying at all.",neg,neg
Used but to new. This item is used but to me it's looks new. The previous really took good care of it and shipped fast to me. I felt his or her trust and I think I'm gonna keep checking more items.,pos,pos
Good book. fine book arrived on time good shape as expected done with review etc etc etc and so forth and so on,pos,pos
Wife loves this movie.. My wife really loves this movie. She was really happy with it. The movie arrived quickly and with no damamge.,pos,pos
"Case in bad condition. Came and I assume it will play fine but the discs will not stay hooked in the package it is so damaged. It has looks like it has been smashed and barely stays closed, is cracked, and the back plastic cover is ripped. I knew it was used but I still expected the packaging to be in better condition for the price.",neg,neg
Works great. I got this one to replace the one that died on me. It was fairly old. This one was much faster and arrived quickly. It was very easy to install. I was very pleased with it.,pos,pos
Plantronics Charger. Great product; does the job. Inexpensive. Great shipping. Would order from this vendor again.,pos,pos
"Very pretty knob.. This little knob replaced a plain damaged knob I had on a little wood door by my fireplace. It looks nice with the stone, wood and the wrought iron fire screen. My experience with Amerock products has been good. The hardware is well made and they offer many different designs.",pos,neg
"WASTE OF MONEY!!!. Cheap, cheap product. The trigger cannot even be pulled because of poor manufacturing~ metal blocks the way. I was not even looking for it to work with caps. I purchased it as part of my little girl's costume for her cowgirl party. At only 4 years of age, she could tell that the trigger was not working and lost interest very quickly.",neg,neg
"Arrived inoperable. Like a few reviewers I, too, had difficulties with the included bulb. I finally found a place that carried the bulb, screwed it in and eagerly turned on the machine to make sure it worked. The light came on in a pleasing glow then immediately popped into a cloud of smoke. When I unscrewed the bulb I noticed the socket was totally damaged. Could have saved myself a bulb had I double checked that first as the cause. Reordered a different model directly from Amazon. Hoping it arrives in time for daughter's slumber party Friday night. Bummer.",neg,neg
"Poor Packaging, Plastic Parts, low quality. Packaging is terrible. For the heavy item the packaging is pretty much useless. Item came dented and box was extremely damaged. Extremely dissapointed on product and WOULD NOT recommend to ANYBODY. As a matter of fact it was easy to open the box as it was already partially open due to the poor quality of the packaging.Returned item",neg,neg
"review of frankenstein. quick delivery, excellent condition. It was exactly as decribed. I would recommend others to your site as well as shop with you again myself. thanks.",pos,pos
"Wrong choice. Turns out I got the wrong item; she wanted one that took batteries. Never told me that but I'm still in the Dog House. Move over, Tiger Woods.",neg,neg
"Very annoying!. This video is really a disappointment, it came with a Thomas piece so naturally my daughter picked it and I thought the bonus ""feature"" wouldn't be mixed in with the actually Thomas stories but I was wrong. My daughter easily lost interest when the people would come on and talk about loving Thomas and getting to ride the real Thomas train... I was totally annoyed.",neg,neg
"As Good As Promised. This was a gift item, it arrived quickly, the content is good, and the recipient loved it. It was a surprise because he didn't know there was a DVD series of this show.",pos,pos
Good Product. Good product just like it was described and fast shipping. Would buy from this person again.,pos,pos
"A piece of junk 3 times over. My first B70 lasted 3 months and stopped pumping water. Keurig replacedd it with a new unit. That one lasted about a month and started shutting off in the middle of brewing. After 90 minutes with customer service and getting the third degree, keurig said we'll send you a new one, but if we don't receive the K-cup holder from that unit by mail within thirty days you will be charged for the repacement unit. A few days later I received a email saying they were out of inventory and it would take 2 weeks to arrive. The third unit finally arrived and guess what, after 2 days and 4 cups of coffee the pump stopped working. After reading all the bad reviews on amazon it appears Keurig has not attempted to fix the problem and just keeps sending out defective units and hoping for the best. I'll be calling today to try and get my money back.",neg,neg
"Received wrong Item. Dear Amazon;I placed this order pictured above; Cobra HG S300 and I received a Cobra S300 instead. I have been greatly to all lengths dissappointed in the handling of this situation. I requested for UPS to come to my house (call tag) to pick this wrong item up and did not get any results from it. Therefore, I Will No longer place another order from ya'll again. If I had received the correct order, I probably would have been a satisfied customer, but like I said, I am greatly dissappointed and would not recommend ordering from amazon. SORRY!!!!",neg,neg
"worst film ever. I saw this movie with my friend a couple of days ago. i said to her, this is real stupid, i could stop watching it right now and i could care less about the ending. She said, ""we saw this movie already"" and she is telling me what happens next so we start getting into an argument, she claims WE saw it and i said, Vat ? i am getting alzheimers?Finally we figured it out. we started to watch this movie together about 3 months ago and i lost interest and i zonked out.adam sandler and all the whos who in jewish comedy were funny in other movies. but this one really eats the bird!skip it!!!!!!!!!!!",neg,neg
"Awsome Turntable. I was totally broke during x-mas season and my lovely girlfriend had dropped hints that she wanted a portable turntable to take along on our vynil digging adventures, so i scoured the internet until i found one that was affordable and seemed to be good quality, The Numark name said it all for me. Prompt delivery and she was the happiest woman in the world. Needless to say i got a little more for christams than i expected(in a GOOD way), and it was GREAT! Oh Yeah, the product......it was in great condition and works perfectly, and the built in speaker....is acually alot louder than i expected. GREAT product and Speedy delivery. Thanks.Ricky Corona (MODesto, CA)",pos,pos
Totally Failed to perform. One of them arrived damaged on the printer head so did not even print one page. The other one did not print as many pages as I'd expected. Besides the color fades away too fast. Contacted the company without any reply. You'd better go for the genuine HP product.,neg,neg
"This shoes are the worse thing than I have bought. In my first play, the shoes were damaged.... i can't believe it... better it had bought Prince shoes... Anyway... Next time, I will make a better decision....",neg,neg
"Very well acted and directed. While the first half feels predictable and very TV movie, theperformances are good enough (especially Helen Mirren) to keep itgoing.And in the second half, this tale of a collage student mother's helperhired to help a woman in an angry depression after suffering a nervousbreakdown gets more complex and unpredictable.The relationship between the two women, and they way their damagedsouls play off each other is quite moving and grown up.Strong subtle direction by Kevin Bacon.Does take a hit for over the top performances from the kids, and otherkey small roles, all playing types, not human beings.",pos,neg
"chiefs. I read this book a long time ago and purchased to share with friends. It is an awesome book! Great prices, quick ship",pos,pos
"great value, great price. Pros: great price, actually does not stick, heavy duty and durable, easy to clean, arrived on time.Cons: metal part of handle gets very hot (keep your hand on rubber grip)and no saute' pan with set (bought the Anolon Ultimate pan from Amazon for $30. works great for everyday use.Advice: unless you're a pro, don't buy the 3 or 5 qt. saute' pan to compliment your 8-piece set, they're overpriced for everyday use.",pos,pos
"Well Worth the Wait and Speculation!. For all the times that the release was delayed, and all the speculation on the title, what the songs would sound like, and all else, this album does disappoint a Clay fan. Clay has this amazing ability to pour so much emotion into whatever he sings, he pulls you into the song. This is especially true if you have seen him perform a song live. And despite the critics trying to pigeonhole his fan base, he appeals to everyone, and the songs on the CD do just that. I have no way to pick to a favorite, its different each time I listen to it.",pos,neg
Hoot is a Hoot!(J/K). It was a fun exiting adventure! I got lost in his way of keeping you on the edge!,pos,neg
What Dreams May Come DVD. I purchased the product and the DVD does not work. I tried it on couple of new DVD players and it seems damaged goods.,neg,neg
"Good seller. Exactly what was ordered and quick shipping. Lightning can affect these hubs, so make sure you invest in a good surge protector. We've learned the hard way: This is the fifth hub we've purchased.",pos,pos
"Disappointed. The product was not opened, but it had obviously been damaged at some point the pills had been very roughly handled to the point that they had lost their smooth exterior making them difficult to swallow. If you have difficulty with pills this makes it even more difficult and some individuals might gag on them. A serious disappointment. Caution is advised. Be sure to open this product as soon as you purchase it to insure that it is in the proper condition so that you have an opportunity to take proper actions if it is not in an appropriate condition.",neg,neg
"Ugh...... I may like Ms. Dion's voice.. This book is torture.. Maybe something got lost in the French translation... but.. in the French tradition, this diatribe is oh-so-emotional and reads like a high-schooler's attempt to write a fairy tale in composition class.. I equate reading this to eating a block of sugar.. And.. another gripe.. This book is so poorly packaged.. Could some of the pictures could at least be in color?",neg,neg
"Geo Hatch lifts. I was suprized with the ease of the installation. Once installed I had to get out ot the way of the hatch due to the lift capacity of these lifts. The old ones I had to assist the hatch then once opened I had to pump the hatch to get them to stay-up. I ordered one for each side and was surprized that they came in 2 seperate boxes!!! They fit well and were installed within 10 minutes. Seems to be perfect at this time, we'll see how long they last. Thanks again, great shipping time as promised.",pos,pos
"It does not fit my 2008 Camry. The description of this item says it fits my 2008 Camry but it does not actually. It is too long in length and too narrow in width. I cannot install it into my car. When I want to replace it online, I found out it's not possible and I have to pay $6.00 if I want to return it. I think Amazon sent me the wrong item to me and it is amazon that made the mistake. I cannot find a way to contact the staff of amazon to illustrate my issue, which is really a bad customer experience.",neg,neg
Great transfer... The blu-ray copy is epic. Truly a work of art that seems lost in the current ages. I have both the DVD and Blu-ray.,pos,neg
Product delayed. I cancelled my order as it had been delayed and I was leaving on vacation before the date it was promised to be shipped.,neg,neg
"You get less than you pay for. Easy enough to assemble.. Very poorly engineered. The holes that you glue dowels into are over sized and sloppy. The top arced section has damaged surface: prior to painting. Upper doors can't line up, they are slightly different sizes and there is NO provision for adjustment or alignment. The hinges do not have counter-sink holes but, the screws provided are flat head so they don't screw down flush (should have round or pan head screws for hinges). The threaded holes in the knobs are also over sized, you can not tighten properly because the screws slip but don't strip.This item is not worth the $92.95 cost (a ""$157.00 savings""). You can find better Chinese furnishings at Kmart and probably save a couple of bucks! -- Larry",neg,neg
"Wrong Item. Ordered one and got the wrong item, the usa female plug looked like India female plug,there is no way the us pin from us devices would enter in this female part.Returned the item to Amazon returns center.",neg,neg
"Product Quality Not As Good As It Used To Be. The Patio Caddie that we received was slightly damaged in shipping (although not badly enough to deal with the hassle of mailing back a return...just some denting). The bad thing about this grill is that it takes forever to heat past 400 degrees and no longer has a grate area to place little ceramic briquets, therefore, the insides will wear out in record time. This will be our last Patio Caddie.",neg,neg
excellent buy. Love the face wash..... Bought two of them because I go through it so much and o only buy online.. thanks! Arrived on time also,pos,pos
Happy with purchase. I am happy with the copy of the Snow White blu-ray I purchased. It is new and factory sealed as stated in the description and it arrived quickly. Thank you for the great service.,pos,pos
"highly recommended!. Break-up into timed sections, question length and content and subjects covered pretty closely matched my exam, which I took 2 weeks ago. Answers to questions explain why one answer is correct and why the others are wrong. Also gives helpful test-taking tips and advice. Highly recommend it!",pos,neg
"Still amazes me!. Where do I begin? In my opinion, Armin Van Buuren may very well be the best trance dj out there these days. I believe this is his best effort yet. Certainly better than his latest disc, 76. Yeah, I realize I'm writing this review a year and a half after the release of Transparance, but that's how good it is. I have not gotten tired of it after constant play for over a year. I am more of a fan of melodic, euphoric trace, so disc one is my favorite. I can't help but get lost in the songs ""Into the Sun"" and ""Spacelover"" which are mixed flawlessley, back to back. Start to finish, this CD is hard to top. CD2 is also fantastic, a bit harder than 1, but nearly as good as disc 1. If you're a fan of AVB, you better have this CD set. If you aren't familiar with him, you must get it. I would rate this CD #2 in my all time trance favorites, right behind Oakenfold's Tranceport. Yeah, it's that good.",pos,neg
"Bad Chop Job. ""Chiefs"" is a made for TV mini series that runs about 4-1/2 hours without commercials. I was hoping to replace my damaged VHS tape copy with a DVD copy. I was greatly disappointed in this copy as it is badly butchered. Not only was it cut down with many segments chopped or eliminated, the editing was a horrible job. It's as though a 5 year old with scissors was turned loose. There are cuts in the middle of scenes, one even in the middle of a conversation. Portions were removed such that some of the subsequent story made no sense, or did not portray the same message as would have come across if the film had been left in its original length.PS if anyone knows of a full length copy out there I'd love to hear about it.",neg,neg
