text,quality,delivery
"crimdog. When I received this item, I was surprised to find it had been dropped and had a nickel sized hole in it and also a large crack. The item was advertised as refurbished, but had no paperwork, instructions or guarantee enclosed. While it appears that it works fine, I feel the seller misled me by selling it as refurbished instead of damaged; also reported that it had a factory guarantee but no proof of the fact.",neg,neg
"Poor Quality Product and Poor Service!. The poster arrived quickly, but it was very poor quality. It was blurry and was obviously a photo of the real thing that was then blown up on a copy machine. I emailed the supplier multiple times with no response. I called and was given instructions on how to return the poster. Sent it back, but no credit to my account or acknowledgement. I finally gave up, which is what they probably expected. Won't do service with this supplier again.",neg,pos
perfect. the bowties came very fast and none were damaged and perfect for my staff to use. it was easy to put on and very adjustable. only downfall is every now and then they would fall off on their own.,pos,neg
"From Michener to MGM: Tahitian Adventures in Paradise. A short little book that is a bit naughty in places reminiscent of a Tennessee William's play. It does picture the beginnings of modernization in old Tahiti, while hearkening back to earlier times when the only way to Papeete was by boat. A keen insight into the reactions of the Polynesians to the modern world and the beginnings of a hybrid culture that moved from gratis open-sensuality to tourist profiteering, with some rousing tales of an assortment of adventure-seeking free-spirits who sought their own unsullied Eden. The reader is left with the impression that it might have been better if the jets had never arrived and the French had never come--then again--who can keep the handsome beauty of Tahiti from the rest of the world. And for a person that grew up watching Adam Troy in Adventures in Paradise--well, those days are gone forever.",pos,neg
"okay order.. the DVD was not in great condition. started skipping after a few times of watching it. but it arrived in good condition, fast shipping, and overall good transaction.",pos,pos
"Biased reporting. This book, like most written and portraying Hurricane Katrina, leads the reader to the conclusion that New Orleans is the only area devastated thereby. For anyone's information, New Orleans was on the West, or weak, side of Katrina. New Orleans was flooded because: 1) elevation there is about 7 feet BELOW sea level and 2)their levy system has NEVER been built to withstand cat 3 or greater storms. EVERY drop of rain that falls in New Orleans has to be pumped out, one way or the other. If the citizens of New Orleans had put more money into improving their levy system instead of the SuperDome, they might very well be living in dry and undamaged homes today instead of morning their dead and trying to put their city back together. New Orleans will be rebuilt someday and I hope and pray that they have learned and benefited from this disaster and won't make the same mistakes again. If you want to read and look at a balanced book coverning Hurricane Katrina, this isn't it.",neg,neg
"IN the beginning. The hulk book is a great There is nothing better than sitting back and getting lost in the world of stan lee, and reading about alittle hulk smash, although not in color i think people forget about the wonderful story telling that stan lee can provide, in some cases i find my self getting lost in the story more than the picture, but jack kirby is a master artist.",pos,neg
"Don't buy this DVD!. The standard DVD edition of the 45th Anniversary Edition of ""Doctor Zhivago"" is a work of sacrilege. For some ungodly reason, the movie is spread out over both sides of Disc 1, rather than being spread out over 2 discs (ala GWTW, etc.). Since I've never had a double-sided disc that didn't arrive damaged, you're wasting your money if you buy this one. Releasing a DVD of one of the greatest movies of all time in this condition is unforgivable.",neg,neg
"Very Cool. I purchased this item because I saw it installed on a friends truck. The purchase was no problems and arrived on time. Installation is much easier if you have 3 people (2 is a must). The installation process is fairly straight forward... be careful to get the bar set to exactly the correct spots (marked on the bar with white/red paint dots). In my case the hole in the tailgate bottom was about 1/16"" off and had to be drilled out a bit more in order to get the tailgate back on the posts. Other than that it went smooth and I am very happy with the results. I installed on a 2007 GMC Sierra Classic with a 6' bed.",pos,pos
"johnny suede. wanted to see this first movie of his, but the disc arrived cracked, the plastic box was fine but when opened, the disc was damaged..... maybe next time.....",neg,neg
"don't waste your money. Bought this for my truck to give it a little more carrying capacity.This was suppose to fit exactly. I checked and rechecked to make sure this would fit.Got it and followed the directions to a T and it would not fit no matter how much I tried. Also recieved the item in damaged condition, but this did not in any way cause it not to fit.They need to let people know whether something will or will not fit, not say it will fit, get it and it doesn't. I would go with a name brand like Helwig and not this off brand made in china.",neg,neg
"trolling motor prop. New in package, exactly as decribed, I ordered wrong size, cheap enough not to return, shipped quickly, hangs nicely on fish shed wall. Reminder to check model #'s first. Much cheaper than box store price. thanks r",pos,pos
"bad keyboard; bad service; DVD problems; mouse problems. The most iritating thing is that you have to press two buttons to do PgUp, PgDn, Home and End.After 20 minutes mouse starts clicking on its own.After a month CD slowed down to 4x. It couldn't recognise lot of CDs and DVDs.Repair disk were damaged.Warrenty is 90 days unless you give Sony lot of personal info.It took Sony's service 43 days to fix the unit.Do not buy Sony laptop.",neg,neg
"Worth Every Cent!. A beautiful weather instrument and a constant conversation piece in our living room.I bought this for my husband for our 31st Wedding Anniversary as a surprise and unexpected gift. It took me a few days mulling over the cost, but it has been well worth it, and the quality is exquisite. It was SO much fun it to see the smile on his face, and the hours we have enjoy together watching this beautiful weather instrument was well worth every cent. Great Shipping Service as well.",pos,pos
Looking for old movies.. Was looking for old movies for my grandchildren for christmas. This fit the bill. Arrived on time to have for Christmas. Thanks,pos,pos
csi. was received faster than expected with package undamaged and in great shape..was so happy it got here in time to give as a christmas gift..will buy from again,pos,neg
"Banquet folding table. Although a well made table, it was delivered damaged. It looked as if it had been thrown around by either the delivery people or the people that shipped it. This was due to the fact that the table was wrapped in plastic rather than being packaged properly. What a shame.",neg,neg
"I give up. I picked this up a few days ago. I just can't get into it. After reading other reviews I know I'm not alone. All of a sudden Lacey and Ian are flirting and kissing. This story is jumping around too quickly. It doesn't make sense. I lost interest too quickly, won't waste time on this.",neg,neg
Favorite Movie. Received item on date promised. Package not damaged. Item was well packaged. Am excited about this movie...one of my very favorite classic movies. Amazon has always been an easy and great way to do my shopping.,pos,neg
"AWESOME video! Kids learn quickly and in a fun way!. I bought this for my 3 year old son for Christmas with money he received and I am definitely NOT sorry! He is ADDICTED to this and the Words Factory DVD's and has learned SO much from them in only a few weeks! Within a few days he knew ALL of the letters, and most of their sounds (and didn't know ANY of them before watching this). My son is also speech delayed (minimally) and these videos have helped him a TON in sounding words out and being more intelligible. I cannot recommend this videos enough, they are worth every penny and more. The songs are catchy, he loves singing to them, and i must admit that I don't mind watching them either LoL. HIGHLY HIGHLY HIGHLY recommend!",pos,neg
"Abstract and confusing text, difficult to follow. This is a book written in a deliberately difficult style. Notation used for equations of motion and stability derivatives is non-standard. There is little in the way of solved examplesthat can illustrate the basic principles to a student. A reader easily gets lost in the myriad of confusing mathematical details, without grasping the physical fundamentals. Not a very useful textbook in an introductory course on flight dynamics and controls.",neg,neg
"Tremendously dissatisfied!. What a horrible experience with this seller. The book arrived twenty-four days after it was ordered, wrapped in a manilla envelope with no padding/protection, and damaged. I alerted the seller of my displeasure and was informed I would receive a refund. To date, it has been sixteen days and no refund has been received. My recommendation: Buy the book - it's well worth it - from another seller!",neg,neg
"DVD did not work!. Disappointed, DVD, did not work. Returning item. Item arrived on time. I will not be ordering any products from this company again.",neg,pos
"A Sinking Ship. This was a gift for my son, who was quite disappointed. It was not what he expected and more than l dvd was damaged. We had to return it.",neg,neg
Summary. Another great classic by Charlotte Bronte! I've loved Jane Eyre since I first read it in Jr. High! What a read. From mean to good. From despair to finding the goodness of mankind. The best book ever to get lost in on a cold snowy afternoon!,pos,neg
"The worst book on the subject.. I must agree with Schroedinger that this is a poorly written book. It seems that novices who've only seen one or two quantum physics texts in their lives fall for the smooth talking style of Griffiths. Don't fall for it! For example, the section on angular momentum and spin is one of the worst I've ever read. Griffiths gets the reader lost in a heap of math without taking the time to describe the picture behind it. (I'm not complaining about the level of math in the book, but his failure in communicating the physical insight or feeling of quantum phenomena.)Even the small book by Paul Davies is better written and more insightful than Griffiths.My personal recommendations are the Feynman Lectures on Physics (volume III) and Introduction to the Quantum Theory by David Park (even Griffiths acknowledges in his own text that Park is an excellent book). After these two you may want to hit Shankar or Sakurai. (As I said above, the book by Davies is pretty good too.)",neg,neg
"What The Hell?. Are you kidding me? 50 Cent delayed this record because he didnt like the way it came out and its still garbage. This is the worst CD I own 22 Tracks and there are only 3 songs worth listening to if you arent already sick of hearing them in the clubs This is really bad, I want my money back...! All this time waiting what a disapoointment... What happened?",neg,neg
"To messy to ever want to do the projects. We have only done a couple of projects, it is extremely messy and will stain. My highschooler had no real interest in it, as my middle schooler finds it interesting but often forgets it even exsists in the house. Everyone in our house lost interest in it pretty quickly. Best for a parent that loves doing these type of activities WITH their kid and doesn't worry to much about messes or stains in their home. Not overly educational, it just tells you to mix this with that, so you are just throwing ingredients together but not really sure what or why it is making formations... not overly amazing formations either... although maybe if we did more, there might be better formations to complete.",neg,neg
Wrangler Jeans are the fastest jeans this side of the Mississippi!. The reason I shopped for Wrangler jeans on Amazon is that it is really hard for me to find my size where I live. (Which is completely stupid because I live in a suburb of Los Angeles!) Perhaps I am not looking hard enough but with Amazon I don't need to spend a bunch of time looking for jeans.Knowing your size is really important if you don't want to end up getting very familair with your post office sending something back. However as a jeans shopper you should know that already.I love Wrangler quality and consistency. I hope they continue to keep up both! The jeans come exactly as I expect them to be and the best part is they get here super fast! I don't pay for expedited shipping but they still get to me in 3 days which is great!Thank you Wrangler and Amazon!Kris Orange,pos,pos
"it can't just be rock and roll can it?. this is my first album by the quireboys so really i can't judge this album on any standards of the past, too me this just sounds like a new fresh faced rock and roll band slogging their guts out with blistering solo's growled vocals that could damaged you and deep lyrics that struck a note with mei've heard from a dealer that he said that their early albums are better..but this is a superb album done to the brim with massive songs and just produced just right it's magnificentyou need this album if you like your rock raunchy growly and with a hint of the blues..well what your waiting for?",pos,neg
"What it says it is. It arrived on time, was as described. I gave this as a gift, and I'm not a singer, but the person I gave it to, says it's wonderful.",pos,pos
"HOW TO FIX UNEXPECTED CRASH BUG. Some very nice person posted this. So I feel it's my duty to spread the word.You may get a ""Word has unexpectedly quit your system has not been damaged"" message. You'll see an angry review below about someone who was broken by this problem.Do the following1. Open your folder with your user name2. Open your library folder3. Open your microsoft folder4. DELETE the following two files:Word Font SubstitutesWord Settings (10)If for some reason you are having trouble finding the files just type them into the folder names into your search engine and you should be able to locate them. Microsoft Word will immediately work again and the files will be recreated automatically.SPREAD THE WORD (v.X)!",pos,neg
"Arrived with defective oil pump. Saw arrived quickly, and worked well for a couple of 3 - 4"" diameter limbs that came down in the yard during the last snowstorm. I noticed after 15 minutes or so that the oil level had not changed, and that the chain appeared dry. I removed the bar and checked the oil holes (outlets for the oil pump to discharge oil onto the bar/chain) and no oil was present. Will be returning to Amazon shortly, which is unfortunate because for the cost and size it seemed like a fairly competent little saw.",neg,pos
"Could have been good. If they would have done a lot less flip-flopping, and had been a little mature it could have been a great movie, but with all their antics I soon lost intrest.",neg,neg
"Great movie. Love this movie, my favorite in the series thus far product arrived on time and was as described also great price for a blu ray at under $10",pos,pos
"Unlike most O'Reilly books, it's poorly written. As a devotee of O'reilly titles (it's the first publisher I usually look to on computer subjects), this one was disappointing. Regardless of whether it covers the subject matter well, the book fails simply because of the writing. It is, at least in the beginning, weighed down by comma series that go on forever, parenthetic notes that are redundant, and points that are lost in a volume of unrelated stuff.The author lacks focus, and the writing style is academic. This is not a practitioner's guide. I ended up purchasing a second UML book within a week.",neg,neg
"good for kitchen. this is the second time I buy this KA. Perfect condition, fast shipping, reliable deal.",pos,pos
Gillete refill. Item just as described works great and arrived quickly. I Will order again when items needed. No problems very happy.,pos,pos
"Repeat customer. This is the 2nd time I have purchased this watch; only because the first one lasted so long. The older still runs but I'm brutal on watchs never taking them off for work. The old watch was damaged to the point, that I could not read it anymore. The older watch is around 5 years old. Great bang for your buck. I also bought a spare Velcro style band since the factory canvas / leather bands tend to be short lived when they get wet contantly. 4 stars becase of the band.",pos,neg
"Fast Delivery. I bought this movie and it was really fast to come I bought it Monday and got it Wednesday. Movie package was not bent, scratched,or damaged.",pos,neg
Piece of junk. I had a similar experience to J. Preston and John Taylor. I've had a dozen or so of these Gardena hose wands over the last 10 years. They're good for a year or two of year-round gardening in Southern California and the parts are interchangeable which probably gives me a couple of years of use from each one. They're expensive but so convenient to use that I put up with the extra cost. Now the wand has been redesigned with forceful and gentle watering heads. The idea is good but the ends blew off after a couple of weeks. I was able to find the parts and put the head back together the first time it happened. The second time the strainers were lost in the bushes and there was nothing I could do but discard the 36-dollar mistake. Preston's theory about manufacture in China sounds plausible.,neg,neg
cell phone battery. Battery ok i guess but it took 2 weeks to get it !Would Not Buy From These People Again ! TOO SLOW !,neg,neg
"Couldn't get the described item.. Amazon had this described as copper core, but I received graphite core TWICE. Nothing wrong with Accel, but Amazon didn't describe the wires correctly and sent the same wrong item the second time. I sent an elaborate explanation of the problem, but the issue was never addressed. It IS a jungle out there.",neg,neg
"I enjoyed this book!. Very interesting and thoughful account of the inner lives of Londons wastrels, wanna be artisits, hangers-on to society and people in general just trying to survive. Rendell's (even writing as Vine) always fascinating insights into the minds, moods and actions of her characters do not fail here. She REALLY knows people, the bohemian flakes, like Jaspers mother, the emotionally damaged and obsessed, and the way children like Jasper know more than the average adult about what is going on around him. The psychological novel is at its height with Vine.",pos,neg
"Lost In Translation. I have this Allman Brothers Band performance in VHS format, and it is amazing. A really classic performance featuring Greg Allman, Dickey Betts, Warren Hayes, Allen Woody and the rest. What a major disappointment with this transer to DVD. While the DVD format gives great color and resolution, there is a deluge of unsavory editing. In the middle of key live performances, interviews are spliced in. (...)But the real travesty is the omission of material from the VHS version, and the rolling of credits while the band blazes on Whippin' Post. This great song is literally cut short in mid-performance. The potential for a great presentation in the DVD format is lost in the editing. The running time claimed is ""approx. 90 minutes"", while it actually is less than 60 minutes. Sloppy job Sony!!!",neg,neg
Norelco Shaver Heads. I could not find the Shaver Heads in any store in my area so getting them from Amazon was a good choice. The heads work great and the order was shipped fast and recieved fast. Thank YouTom Rufner,pos,pos
"works well, interops with prism2 and airport extreme. just a quick note to agree with others here that this AP is a very nice, small, and easy to use AP. i got this earlier today because my linksys WAP11 was damaged in a move (the ethernet link is flakey, now) and decided to go G. glad i did.i (still) use am 802.11b NIC (lucent orinoco gold) and my girlfriend uses the airport extreme. both work flawlessly with this device.highly reccomended for a simple AP (no integrated router, switch).",pos,neg
"Not totally happy. One of the CD's arrived damaged - cracked and unable to use. It was a gift for my husband which make it worse. Amazon should replace thr CC for me, but to offer so far.",neg,neg
"good toy, hard to wind-up. I bought this for me 3 year old, who loves to play with our tape measure. He was very interested in it initially, but has a lot of trouble winding it back up and so lost interest.",neg,neg
"Caged Canary. With the attention-grabbing theme of time travel, Curry could have gone far into the literary cosmos with this text but instead the book runs out of fuel far short of where this plot could have ventured. She goes into long, rambling descriptions of incidential items and flash backs almost losing her young readers in wordy passages barely connected to preceeding thoughts. Curry could have done a better job with the main character's impressions of 17th century London. The author should have better expressed the differences in the character's life in two different worlds instead of describing rocks, curtains and feathers, etc.I purchased this book as a donation for a school library. I hope the youngsters don't get lost in this book's outer space of disconnected words. Curry kept this canary in the cage.",neg,neg
"Not bad, not bad at all.. After buying the Olympus Stylus Epic Zoom 80 QD CG Camera I was pleased by the results of the picture quality of this slim line camera. Other features like turning on/off flash saved on the battery life. I liked being able to include myself in the shot with the timer delayed option. Red eye reduction worked great. This is a good camera for folks who just like to aim and shoot.Focus and flash is automatic. Red light in view finder tells if your to close, but it does take good close up face shots. Yea, this camera is a keeper. Would buy again.",pos,neg
"Maybe I expect too much. I got this photo frame as a gift and it's the only digital frame I've ever used so I really wonder if I just expect more or if this thing is defective. All of the photos I put on it are super contrasty - to the point that I can't use black & white images at all and detail is lost in almost all of the pictures - faces are terribly washed out. Reds are really red and colors in general are just very wonky. Is this just because it's a digital frame and they're all like this or is it just this one? I get the horizontal lines through pictures from time to time that others have mentioned and I agree that it does not make sense that the music and pictures don't work together.Also, I wish Amazon would change the photo of the product because it is misleading. Even though the description says it's a 16:9 ratio that frame in the picture is clearly not 16:9.",neg,neg
A must have for movie collectors offered at Amazon.com. Ordered this great movie on blu-ray dvd from Amazon.com. I could not find it in blu-ray at retail markets. It is suspenseful and exciting to watch with great acting. It is a must for Michael Douglas and Glenn Close fans. The quality of the dvd was great and it arrived quickly and in great condition in good packaging.,pos,pos
"bad quality - coating is damaged. bad assistance. no refund.. Coating is damaged. After hardly a few uses coating is in your food!!I've send it to Presto, Then I've waited for about 6 month to get my replacement, and guess what? After a week replaced skillet coating is damaged too. And you pay your shipping and it costs more to send it back.It's junkie skillet. no use at all.dissapoited.",neg,neg
great service. Fast shipping Movie was one I wanted to purchasean I saw it at a good price thought it was a good time to order it.,pos,pos
"Love. LOVE LOVE SEASON 6 for some reason even though many hated it. Fast shipping, product brand new so there have been no b.s.issues with skipping or episodes not playing. Im dealing w/ that on many other weeds dvds.",pos,pos
"Okay, I guess. I didn't buy this from Amazon but the other seller took forever to send it so I'm giving it 1 star.I gave it another star for the frustration free packaging.",neg,neg
"the kate logan affair. Very quickly a sense of dread was felt- script seemed poorly written, lacked believability-Alexis hard to accept as police officer. Who on earth thought of that way of ""seducing"" the french guy? Anyway i could'nt sense any motivation for her attempting it: there was no suggestion that there was any threat to her job.At the point where Alexis' sidearm is discharged i could'nt stand anymore.Summary:Script- awful, Direction-if there was any, incompetent, Alexis- totally lost in attempting the character, even allowing for deficiences in script and direction.",neg,neg
book. Book arrived quickly and in excellent condition! I am very pleased with my purchasing experience.,pos,pos
